{
  "$schema": "https://json-schema.org/draft/2020-12/schema",
  "$id": "https://tasleemat.pmo/schemas/completed/PMO-02.05.schema.json",
  "title": "Completed AI MODEL CARD AND FACT SHEET Data Contract",
  "description": "Additive structural schema validating completed AI MODEL CARD AND FACT SHEET artifact data payloads (PMO-02.05).",
  "type": "object",
  "properties": {
    "artifact_id": {
      "type": "string",
      "const": "PMO-02.05"
    },
    "metadata": {
      "type": "object",
      "properties": {
        "project_name": {
          "type": "string",
          "minLength": 1
        },
        "project_code": {
          "type": "string"
        },
        "date_prepared": {
          "type": "string",
          "format": "date"
        },
        "project_manager": {
          "type": "string",
          "minLength": 1
        },
        "prepared_by": {
          "type": "string",
          "minLength": 1
        },
        "version": {
          "type": "string"
        },
        "status": {
          "type": "string",
          "enum": [
            "draft",
            "baselined",
            "in_review",
            "approved"
          ]
        }
      },
      "required": [
        "project_name",
        "date_prepared",
        "project_manager",
        "prepared_by"
      ]
    },
    "model_identification_and_provenance": {
      "type": "object",
      "properties": {
        "model_name_and_version": {
          "type": "string",
          "minLength": 1,
          "description": "The model at a specific version, with the date that version was produced. A card that names a model rather than a version describes whichever build happens to be deployed when it is read, and the answer is rarely the one that was assessed."
        },
        "developer_and_provenance": {
          "type": "string",
          "minLength": 1,
          "description": "Who built it, whether it was trained in-house, fine-tuned, or acquired, and from what base model. Provenance determines which of the sections that follow can be answered at all, and it is usually the section that is missing when a question is asked."
        },
        "architecture_and_configuration": {
          "type": "string",
          "minLength": 1,
          "description": "The architecture family, the parameter count, and the settings that affect behaviour. The settings are the part that matters, because the same architecture with different decoding parameters is a different system."
        },
        "training_method_and_compute": {
          "type": "string",
          "minLength": 1,
          "description": "How it was trained, over what period, and at what cost. Compute is recorded because it bounds reproducibility: a result that needed a compute allocation nobody can obtain again is not a result that can be re-derived."
        },
        "licence_and_usage_terms": {
          "type": "string",
          "minLength": 1,
          "description": "The licence, who may use it, and under what restrictions. A model used outside its licence is a legal exposure that no technical section of this card addresses."
        },
        "related_artefacts": {
          "type": "string",
          "minLength": 1,
          "description": "The model, the code, the weights and the data, each with where it lives. A card that lists no locations is a description, and a description cannot be checked against anything."
        }
      },
      "required": [
        "model_name_and_version",
        "developer_and_provenance",
        "architecture_and_configuration",
        "training_method_and_compute",
        "licence_and_usage_terms",
        "related_artefacts"
      ]
    },
    "intended_use_and_out_of_scope_use": {
      "type": "object",
      "properties": {
        "primary_use": {
          "type": "string",
          "minLength": 1,
          "description": "The task the model is for, stated as an input and an output. An input and an output can be tested; a purpose cannot."
        },
        "secondary_use": {
          "type": "string",
          "minLength": 1,
          "description": "What else it may legitimately be used for, if anything. Recorded separately because a use that is merely tolerated and one that is endorsed need different controls, and a card that lists only the endorsed one hides the tolerated ones."
        },
        "out_of_scope_use": {
          "type": "string",
          "minLength": 1,
          "description": "The uses it must not be used for, with the reason for each. This section is the one that makes the card usable by someone deciding whether to deploy it, and a card without it can only say what the model is for."
        },
        "user_and_audience": {
          "type": "string",
          "minLength": 1,
          "description": "Who operates it, and who is subject to its output. The two are routinely treated as one, and the conflation is how a system that scores applicants comes to be described as a tool that helps recruiters write better."
        },
        "operating_conditions": {
          "type": "string",
          "minLength": 1,
          "description": "The inputs it expects, the conditions it was tested under, and the conditions under which it should not be used. These are the boundaries of the evaluation in section 4, and a metric read outside them is not a weaker claim, it is a wrong one."
        },
        "human_oversight_requirement": {
          "type": "string",
          "minLength": 1,
          "description": "Where a person must review an output before it is acted on. Oversight specified as a general principle rather than as points in a workflow does not survive contact with a deadline."
        }
      },
      "required": [
        "primary_use",
        "secondary_use",
        "out_of_scope_use",
        "user_and_audience",
        "operating_conditions",
        "human_oversight_requirement"
      ]
    },
    "training_data": {
      "type": "object",
      "properties": {
        "datasets": {
          "type": "string",
          "minLength": 1,
          "description": "Each dataset by name, with its owner and the date it was collected. A dataset named only by type cannot be checked for permission, and permission is what blocks first."
        },
        "provenance_and_collection_method": {
          "type": "string",
          "minLength": 1,
          "description": "Where each dataset came from and how it was gathered. Collected data carries the practices of the period and place it came from, whether or not those were examined."
        },
        "demographic_and_geographic_coverage": {
          "type": "string",
          "minLength": 1,
          "description": "Who and where the data represents, and who and where it does not. A dataset that represents a population accurately says so; the field matters because its absence is what allows a model to be applied to a population nobody measured."
        },
        "time_period_covered": {
          "type": "string",
          "minLength": 1,
          "description": "The span the data covers, and what happened during it. A model trained on a period of stable conditions inherits the assumption that conditions will remain stable, and the card is where that assumption is written down."
        },
        "licence_and_consent_basis": {
          "type": "string",
          "minLength": 1,
          "description": "The basis on which each dataset may be used, and whether consent was obtained where it was required. Where consent was not obtained, that is the fact to record, not an absence to leave blank."
        },
        "preprocessing_and_filtering": {
          "type": "string",
          "minLength": 1,
          "description": "What was removed, resampled or imputed, and on what basis. Filtering is where a dataset acquires the shape of the population the model will then fail on, and it is rarely the step examined."
        },
        "known_dataset_limitations": {
          "type": "string",
          "minLength": 1,
          "description": "What the dataset cannot represent. This is the field that prevents a metric from being read as a general claim, and it is almost always empty."
        }
      },
      "required": [
        "datasets",
        "provenance_and_collection_method",
        "demographic_and_geographic_coverage",
        "time_period_covered",
        "licence_and_consent_basis",
        "preprocessing_and_filtering",
        "known_dataset_limitations"
      ]
    },
    "evaluation_and_performance": {
      "type": "object",
      "properties": {
        "evaluation_data": {
          "type": "string",
          "minLength": 1,
          "description": "The data the evaluation was run on, and whether it is disjoint from the training data. Disjointness is the first thing to check in any evaluation, and its absence invalidates every number in the section."
        },
        "metrics": {
          "type": "string",
          "minLength": 1,
          "description": "Each metric, its value, and the confidence interval or sample size behind it. A single figure with no interval is a point presented as a range, and decisions get made on it."
        },
        "performance_by_subgroup": {
          "type": "string",
          "minLength": 1,
          "description": "The same metrics for each group the model affects, with the sample size for each. A subgroup figure from a small sample is not a measurement, and the sample size is what distinguishes the two."
        },
        "baseline_comparison": {
          "type": "string",
          "minLength": 1,
          "description": "What the model is compared against, and by how much. A model compared only with a trivial baseline can be both better than it and useless."
        },
        "threshold_and_operating_point": {
          "type": "string",
          "minLength": 1,
          "description": "The threshold in force, and what the alternatives would cost. A model is a set of trade-offs rather than a single system, and the trade-off is only visible once a threshold is fixed."
        },
        "evaluation_method_and_limitations": {
          "type": "string",
          "minLength": 1,
          "description": "How the evaluation was conducted, by whom, and what it does not establish. An evaluation conducted by the team that built the model is legitimate, and it is a fact that belongs on the card."
        },
        "robustness_and_failure_modes": {
          "type": "string",
          "minLength": 1,
          "description": "How the model behaves under input it was not tested on, and the known ways it fails. Known failure modes are more useful than a robustness score, because a reader can act on them and cannot act on a score."
        }
      },
      "required": [
        "evaluation_data",
        "metrics",
        "performance_by_subgroup",
        "baseline_comparison",
        "threshold_and_operating_point",
        "evaluation_method_and_limitations",
        "robustness_and_failure_modes"
      ]
    },
    "ethical_fairness_and_safety_considerations": {
      "type": "object",
      "properties": {
        "affected_groups": {
          "type": "string",
          "minLength": 1,
          "description": "The groups whose outcomes the model determines, named. Groups described in aggregate on the basis of a test are not the same as the group that performs worst on it."
        },
        "known_bias": {
          "type": "string",
          "minLength": 1,
          "description": "The specific ways this model is unfair to this group, stated so that they could be false. A field titled \"bias\" that says the model may be biased is a heading; \"the model scores this group lower on historic completion rates\" is a claim that can be measured and can turn out to be wrong."
        },
        "safety_risks": {
          "type": "string",
          "minLength": 1,
          "description": "The ways the model could cause harm, by severity, with the conditions under which each arises. Severity is what determines the control, and a risk listed without severity is a list of possibilities."
        },
        "dual_use_and_misuse_potential": {
          "type": "string",
          "minLength": 1,
          "description": "How the model could be used to cause harm, and what has been done about it. Relevant to a model that generates as well as one that classifies, and usually unstated."
        },
        "environmental_and_resource_impact": {
          "type": "string",
          "minLength": 1,
          "description": "The energy and compute consumed, and by whom bears it. Recorded because it is a real cost that appears in no other section, and because it is usually the only figure an external party can verify."
        },
        "data_privacy_impact": {
          "type": "string",
          "minLength": 1,
          "description": "What the model can reveal about individuals in its training data, and whether it has been tested for it. Extraction and memorisation are testable, and the test is the only thing that distinguishes a considered answer from an assumption."
        }
      },
      "required": [
        "affected_groups",
        "known_bias",
        "safety_risks",
        "dual_use_and_misuse_potential",
        "environmental_and_resource_impact",
        "data_privacy_impact"
      ]
    },
    "limitations_monitoring_and_change_control": {
      "type": "object",
      "properties": {
        "known_limitations": {
          "type": "string",
          "minLength": 1,
          "description": "What the model cannot do, stated plainly. This is the section a reader consults after an incident, and a card that is optimistic in it is a card that will not be consulted a second time."
        },
        "out_of_distribution_behaviour": {
          "type": "string",
          "minLength": 1,
          "description": "How the model behaves on inputs unlike its training data, and whether that has been measured. A model given a population it never saw does not fail loudly, which is what makes this worth recording."
        },
        "production_monitoring": {
          "type": "string",
          "minLength": 1,
          "description": "What is watched after deployment, against what baseline, and how often. Drift is a property of the relationship between the model and the world, not of the model, so a launch measurement is the first of a series."
        },
        "monitoring_thresholds": {
          "type": "string",
          "minLength": 1,
          "description": "What result triggers action, written before the result is known. A threshold set after seeing a number is a description of that number."
        },
        "retraining_and_update_policy": {
          "type": "string",
          "minLength": 1,
          "description": "When the model will be retrained, what triggers it, and who approves. Without this the model is updated whenever someone has time, and the change is then invisible to everything above it in this card."
        },
        "version_change_record": {
          "type": "string",
          "minLength": 1,
          "description": "What changed between this version and the last, and why. Models change often and silently, and a card with no change record cannot answer what was in force when an incident occurred."
        },
        "decommissioning_plan": {
          "type": "string",
          "minLength": 1,
          "description": "How and when the model will be retired, and what happens to the data it holds. A model in production with no retirement plan is a system whose cost grows and whose obligations are never discharged."
        }
      },
      "required": [
        "known_limitations",
        "out_of_distribution_behaviour",
        "production_monitoring",
        "monitoring_thresholds",
        "retraining_and_update_policy",
        "version_change_record",
        "decommissioning_plan"
      ]
    }
  },
  "required": [
    "artifact_id",
    "metadata",
    "model_identification_and_provenance",
    "intended_use_and_out_of_scope_use",
    "training_data",
    "evaluation_and_performance",
    "ethical_fairness_and_safety_considerations",
    "limitations_monitoring_and_change_control"
  ]
}